{"schemaVersion":"dromio.user-event.v1","eventId":"event-1","type":"user_state.updated","tenantId":"tenant-1","applicationId":"app-1","userId":"user-1","threadId":"thread-1","sequence":1,"timestamp":"2026-01-01T00:00:00Z","correlationId":"command-1","requestId":"request-1","commandId":"command-1","payload":{"version":1}}
